{
  "generated_at": "2026-07-21T14:06:35",
  "snapshot_id": "fc1cc76859e8c126",
  "name": "AutoPaperReader Wiki",
  "count": 12,
  "publish_ready": false,
  "publish_checks": {
    "metadata_complete": false,
    "taxonomy_clean": false,
    "no_duplicate_reports": true,
    "has_review_plan": false,
    "has_generated_pages": true,
    "artifacts_present": true
  },
  "quality_score": 73.8,
  "coverage": {
    "taxonomy": "75%",
    "review_plan": "0%",
    "code_observation": "67%",
    "research_lines": 4
  },
  "queue_sizes": {
    "quality": {
      "missing_required_metadata": 3,
      "needs_review_plan": 12,
      "due_review": 0,
      "no_code_observation": 4,
      "taxonomy_drift": 1,
      "duplicate_reports": 0,
      "taxonomy_sparse": 3,
      "taxonomy_dense": 4,
      "high_importance": 2
    },
    "review": {
      "due": 0,
      "needs_plan": 12,
      "scheduled": 0,
      "high_priority": 2
    },
    "inbox": {
      "count": 0,
      "duplicates": 0
    }
  },
  "risk_queue_sizes": {
    "missing_required_metadata": 3,
    "taxonomy_drift": 1,
    "duplicate_reports": 0,
    "needs_review_plan": 12,
    "due_review": 0,
    "freshness_due": 0,
    "freshness_stale": 0,
    "inbox_duplicates": 0
  },
  "action_groups": [
    {
      "group": "taxonomy",
      "count": 117
    },
    {
      "group": "review",
      "count": 12
    },
    {
      "group": "quality",
      "count": 4
    },
    {
      "group": "metadata",
      "count": 3
    }
  ],
  "governance_policy": {
    "taxonomy_load": {
      "min_structure_labels": 3,
      "min_tags": 3,
      "max_tags": 10,
      "max_methods": 8
    },
    "taxonomy_actions": {
      "singleton_max_count": 1,
      "watch_share": 0.4,
      "watch_min_count": 4,
      "split_share": 0.6,
      "split_min_count": 5
    },
    "taxonomy_balance": {
      "high_score_below": 45,
      "medium_score_below": 70,
      "singleton_medium_count": 3,
      "unused_medium_count": 3
    },
    "coverage": {
      "high_score_below": 70,
      "medium_score_below": 90,
      "missing_high_min": 2
    }
  },
  "active_status_workflow": "personal",
  "research_lines": [
    {
      "name": "Parallel Decoding with Diffusion Models",
      "count": 4,
      "owner": "decoding-owner",
      "team": "generation",
      "cadence": "biweekly",
      "owner_note": "Track diffusion language model and speculative decoding updates.",
      "roles": {
        "followup": 2,
        "foundation": 1,
        "variant": 1
      },
      "code_coverage": "75%",
      "avg_importance": 4.2
    },
    {
      "name": "LLM Serving",
      "count": 3,
      "owner": "",
      "team": "",
      "cadence": "",
      "owner_note": "",
      "roles": {
        "main": 1,
        "system": 1,
        "tooling": 1
      },
      "code_coverage": "33%",
      "avg_importance": 4.0
    },
    {
      "name": "Efficient Attention Kernels",
      "count": 2,
      "owner": "kernel-owner",
      "team": "systems",
      "cadence": "monthly",
      "owner_note": "Review new GPU kernel and serving papers.",
      "roles": {
        "foundation": 1,
        "system": 1
      },
      "code_coverage": "100%",
      "avg_importance": 4.5
    },
    {
      "name": "Unassigned",
      "count": 2,
      "owner": "",
      "team": "",
      "cadence": "",
      "owner_note": "",
      "roles": {},
      "code_coverage": "50%",
      "avg_importance": 2.0
    },
    {
      "name": "VLM Acceleration",
      "count": 1,
      "owner": "",
      "team": "",
      "cadence": "",
      "owner_note": "",
      "roles": {
        "main": 1
      },
      "code_coverage": "100%",
      "avg_importance": 4.0
    }
  ],
  "artifact_summary": {
    "count": 98,
    "missing": [],
    "hashes": [
      {
        "href": "index.html",
        "kind": "page",
        "sha256": "2b1db67b2014ef82f37854724a6da17bd4890bac3075cdc16db14e6942e890bf",
        "status": "ok"
      },
      {
        "href": "command.html",
        "kind": "page",
        "sha256": "d7d5b7c76b26085971c0647aa7b97d1f233f6f261ce3a34710cf26ea67fd8673",
        "status": "ok"
      },
      {
        "href": "library.html",
        "kind": "page",
        "sha256": "7be9e1998bff1b60e7a65ed0ce14cf1365d042d11804075b258a987ee3666f40",
        "status": "ok"
      },
      {
        "href": "dashboard.html",
        "kind": "page",
        "sha256": "c6ae579dc59519a3a096d1b3cfe24cd76d6e13526f09b096e09b24e08044bde8",
        "status": "ok"
      },
      {
        "href": "actions.html",
        "kind": "page",
        "sha256": "8e1167a0ed11dd07facc946960bd3b87eb8b467d15270825b41848d159e3bd7b",
        "status": "ok"
      },
      {
        "href": "priority.html",
        "kind": "page",
        "sha256": "fa7d6cb7003d7b50ec8ca10a6679e09c2599f2343730b6c127b3efbd36244ef8",
        "status": "ok"
      },
      {
        "href": "queues.html",
        "kind": "page",
        "sha256": "8fa537d85486848fb758ceddb1cf5ea62081959304335f5eb2e2f23020b5f74e",
        "status": "ok"
      },
      {
        "href": "cohorts.html",
        "kind": "page",
        "sha256": "f8c8320b7691f2e9a9e819f6c7d266a3c2432445b440e1cad4b7dd767682f26e",
        "status": "ok"
      },
      {
        "href": "collections.html",
        "kind": "page",
        "sha256": "8819a89414a65484f68258a9a9d9d3280235b43628361e360ca7b8d691964141",
        "status": "ok"
      },
      {
        "href": "balance.html",
        "kind": "page",
        "sha256": "71707656ab7327b2bfb79f6427fc060870ff42e53297f0a4ef422a41ac94e74b",
        "status": "ok"
      },
      {
        "href": "coverage.html",
        "kind": "page",
        "sha256": "ba6e4e59737ab144cca90f2e1dff5df7dd063ae57a7d419b279c9f6b987ffca2",
        "status": "ok"
      },
      {
        "href": "facets.html",
        "kind": "page",
        "sha256": "7dded928eaeaaa59f46fcb025ff83b7424a8dedb0f0b629c28c5263936e3103d",
        "status": "ok"
      },
      {
        "href": "related.html",
        "kind": "page",
        "sha256": "67b7a51c1b44f06cf71d02f475c40446719109d59e7d6a4703010ca96e5def45",
        "status": "ok"
      },
      {
        "href": "gaps.html",
        "kind": "page",
        "sha256": "c0f573eb0c046b15eb27f216d05c60affcb001bb46602e3acb292261da164c0c",
        "status": "ok"
      },
      {
        "href": "board.html",
        "kind": "page",
        "sha256": "a7dd4eb195a8ab548268bfbad7e48f473cf999cf846d3170843b135b46f0fa5f",
        "status": "ok"
      },
      {
        "href": "workflow.html",
        "kind": "page",
        "sha256": "7705b2ebb54bc6a572f0ec5c0935a67256d992a89c41a2f2fe90734e0b710078",
        "status": "ok"
      },
      {
        "href": "status.html",
        "kind": "page",
        "sha256": "d366374fbef307102a07d2d68f53824194adc1287753b6ad7da796430a86dd81",
        "status": "ok"
      },
      {
        "href": "views.html",
        "kind": "page",
        "sha256": "9d01f7adebeb6e3b4989a8907c62e52c2b84a0ebcad71ab94d075eb81f9f76e1",
        "status": "ok"
      },
      {
        "href": "presets.html",
        "kind": "page",
        "sha256": "a4ce80d8f3e4fac63bc6f829726389f8c10cde77ebeb11d1836cae517e361178",
        "status": "ok"
      },
      {
        "href": "batch.html",
        "kind": "page",
        "sha256": "dd0490fe1c4f97ad40df1cd9da298722b2d37615db4df96eaa232727c0178f24",
        "status": "ok"
      },
      {
        "href": "pivot.html",
        "kind": "page",
        "sha256": "60d2e6ee90ec58a07d5b79836f7312ee4ae094a422cb547651b5db3c2f5ce0fd",
        "status": "ok"
      },
      {
        "href": "compare.html",
        "kind": "page",
        "sha256": "5dcc2c26a10ea7ab46058818b153dd420cf56b9648ef4da27fdfd88514ac926c",
        "status": "ok"
      },
      {
        "href": "taxonomy_map.html",
        "kind": "page",
        "sha256": "f57cc7888dabb74f97d292d59ca598db1b22ebcc05651e32866a8903386f1499",
        "status": "ok"
      },
      {
        "href": "clusters.html",
        "kind": "page",
        "sha256": "1eb7de3076bd430b32490fa80c3cef0b7e24a8e0509010b2d3895c41add6d6a1",
        "status": "ok"
      },
      {
        "href": "roadmap.html",
        "kind": "page",
        "sha256": "34ed73950065f630e87ea3f99dbf657a1167a70d311dabc24233ab3c6cb672ca",
        "status": "ok"
      },
      {
        "href": "scale.html",
        "kind": "page",
        "sha256": "18ab17d25fadfd61c53d4ecabdcdb38de81a4e5df461cabd93561ec2fcd83419",
        "status": "ok"
      },
      {
        "href": "ownership.html",
        "kind": "page",
        "sha256": "212c440bef65228d651ef55925381b0dd02e502ad5ec434242e0b8add606a9de",
        "status": "ok"
      },
      {
        "href": "routing.html",
        "kind": "page",
        "sha256": "d0f0c75dd1b39ec346daf101fc69ed978341e30cff2640d6dcd9d0191595779b",
        "status": "ok"
      },
      {
        "href": "onboarding.html",
        "kind": "page",
        "sha256": "73e943a2243f873a59c3f49930f9130f589541818c286b47ce174483ad1d8d9b",
        "status": "ok"
      },
      {
        "href": "catalog.html",
        "kind": "page",
        "sha256": "83db22ed0090b20d25d511b0465a7c90046ce4e6c0a16f25ce084c1ec43de773",
        "status": "ok"
      },
      {
        "href": "intake.html",
        "kind": "page",
        "sha256": "77a576c4e747c5e66ab04a82850aa30d25a685e16c879e05a256ea561a360897",
        "status": "ok"
      },
      {
        "href": "inbox.html",
        "kind": "page",
        "sha256": "0ef403cc75938d62908c6703233129ca7c5891230df7b476daf731b0d3b410d0",
        "status": "ok"
      },
      {
        "href": "dedupe.html",
        "kind": "page",
        "sha256": "bb250ec88b6abcd5b772bf0bbba25445a9a7256bba5b94ad2630c5ed2d4ebc78",
        "status": "ok"
      },
      {
        "href": "registry.html",
        "kind": "page",
        "sha256": "11dd7796c9e934471b6e7b91f3e27d815b88c3c04ebb2eefd776b739b677cc28",
        "status": "ok"
      },
      {